0,2017-01-07 03:42:43 -0600,/t/rust,Exploring the limits of Rust one-liners • /r/rust,https://www.reddit.com/r/rust/comments/5mhx4f/exploring_the_limits_of_rust_oneliners/,/u/aleph,5
4,2017-01-07 01:32:58 -0600,"/t/compsci,/t/dotnet",Microsoft's Scorched Earth History and The Current Crossroads,http://buff.ly/2jm2YB7,/u/JeremyMorgan,3
1,2017-01-06 10:46:32 -0600,/t/compilers,A Tourist’s Guide to the LLVM Source Code,http://blog.regehr.org/archives/1453,/u/av,25
2,2017-01-06 23:01:02 -0600,/t/release,Terminator 1.0 released,https://launchpad.net/terminator/+announcement/14357,/u/clacke,5
0,2017-01-06 07:33:57 -0600,/t/hardware,Hands On With The First Open Source Microcontroller (RISC-V),http://hackaday.com/2017/01/05/hands-on-with-the-first-open-source-microcontroller/,/u/calvin,32
0,2017-01-06 14:00:06 -0600,"/t/graphics,/t/javascript",Viz.js — GraphViz in your browser,http://mdaines.github.io/viz.js/,/u/chadski,12
8,2017-01-06 06:01:39 -0600,/t/unix,hstr - Bash and Zsh shell history suggest box,https://github.com/dvorka/hstr,/u/fs111,12
0,2017-01-06 20:43:45 -0600,"/t/browsers,/t/css",How I Destroyed my Blog's Performance with CSS Background-Blend-Modes,https://learntemail.sam.today/blog/1-css-property-that-will-ruin-your-scroll-performance/,/u/samtoday,2
2,2017-01-06 08:31:43 -0600,/t/haskell,Intro to Parsing with Parsec in Haskell,https://jakewheat.github.io/intro_to_parsing/#_summary_of_sections,/u/julienXX,13
0,2017-01-06 10:30:29 -0600,"/t/linux,/t/networking",iproute2 cheat sheet,http://baturin.org/docs/iproute2/,/u/antifuchs,10
11,2017-01-06 01:07:14 -0600,/t/practices,Web adblockers and the potential for recreating the Usenet killfile problem,https://utcc.utoronto.ca/~cks/space/blog/web/AdblockersKillfileProblem,/u/evaryont,13
1,2017-01-06 05:31:52 -0600,"/t/hardware,/t/reversing",Diving back into coreboot development,https://puri.sm/posts/diving-back-into-coreboot-development/,/u/1amzave,12
2,2017-01-06 10:47:18 -0600,"/t/javascript,/t/web",When node.js is the wrong tool for the job,https://medium.com/@jongleberry/when-node-js-is-the-wrong-tool-for-the-job-6d3325fac85c,/u/av,4
0,2017-01-06 09:52:58 -0600,"/t/historical,/t/ios",The iPod-based interface that lost out to iOS for the iPhone,http://sonnydickson.com/2017/01/06/the-ipod-based-interface-that-lost-out-to-ios-for-the-iphone/,/u/calvin,8
1,2017-01-06 10:57:10 -0600,"/t/video,/t/historical",Before Netflix: The World's First Streaming Service,http://tedium.co/2017/01/05/first-streaming-service-itv-hong-kong/,/u/jumex,4
7,2017-01-05 18:21:24 -0600,"/t/networking,/t/unix",select(2) is fundamentally broken,https://idea.popcount.org/2017-01-06-select-is-fundamentally-broken/,/u/hypepat,21
0,2017-01-06 12:52:42 -0600,/t/javascript,TypeScript 2.1: keyof and Lookup Types,https://blog.mariusschulz.com/2017/01/06/typescript-2-1-keyof-and-lookup-types,/u/joshuacc,4
12,2017-01-05 22:54:38 -0600,"/t/practices,/t/python",python 3k17,http://www.tedunangst.com/flak/post/python-3k17,/u/friendlysock,10
0,2017-01-06 07:56:55 -0600,"/t/philosophy,/t/testing",The fourfold path to software quality,https://codewithoutrules.com/2017/01/06/path-to-software-quality/,/u/itamarst,3
0,2017-01-06 09:17:55 -0600,"/t/design,/t/practices",Scaling product design with Blueprint,https://medium.com/@palantir/scaling-product-design-with-blueprint-25492827bb4a,/u/markelliot,5
0,2017-01-06 19:17:54 -0600,/t/hardware,"Air Conditioner Speaks Serial, Just Like Everything Else",http://hackaday.com/2017/01/06/air-conditioner-speaks-serial-just-like-everything-else/,/u/pizzaiolo,1
32,2017-01-05 11:19:43 -0600,"/t/c,/t/compilers,/t/compsci",undefined behavior and the purpose of C,http://www.yodaiken.com/2017/01/05/undefined-behavior-and-the-purpose-of-c/,/u/vyodaiken,15
3,2017-01-06 04:41:52 -0600,"/t/culture,/t/practices",The Reality of Developer Burnout,https://www.kennethreitz.org/essays/the-reality-of-developer-burnout,/u/mulander,15
0,2017-01-06 09:59:46 -0600,/t/graphics,Maya for Beginners,https://robots.thoughtbot.com/maya-for-beginners,/u/flyingfisch,4
1,2017-01-05 20:16:59 -0600,"/t/linux,/t/security",Announcing: NixOS Security Team,http://lists.science.uu.nl/pipermail/nix-dev/2017-January/022447.html,/u/grahamc,9
