0,2016-09-13 09:27:02 -0500,"['/t/distributed', '/t/practices']",Data on the Outside versus Data on the Inside,https://blog.acolyer.org/2016/09/13/data-on-the-outside-versus-data-on-the-inside/,/u/antifuchs,2
1,2016-09-12 21:23:17 -0500,['/t/ask'],Any Crustaceans going to Strange Loop?,/s/lfwzfn/any_crustaceans_going_strange_loop,/u/bsima,5
30,2016-09-12 05:04:33 -0500,['/t/ask'],What are you working on this week?,/s/x3rzze/what_are_you_working_on_this_week,/u/caius,19
5,2016-09-12 14:01:40 -0500,"['/t/distributed', '/t/security']",Scalable and secure access with SSH,https://code.facebook.com/posts/365787980419535/scalable-and-secure-access-with-ssh/,/u/lukas,7
4,2016-09-12 06:54:12 -0500,['/t/security'],MySQL exploit remote root code execution CVE-2016-6662,http://legalhackers.com/advisories/MySQL-Exploit-Remote-Root-Code-Execution-Privesc-CVE-2016-6662.html,/u/henkjan,18
1,2016-09-12 21:09:20 -0500,"['/t/practices', '/t/satire']",When someone gives you a bug,https://www.reddit.com/r/ProgrammerHumor/comments/2spd2s/when_someone_gives_you_a_bug_long/,/u/friendlysock,11
2,2016-09-12 16:17:58 -0500,['/t/go'],Golang concepts from an OOP point of view,https://github.com/luciotato/golang-notes/blob/master/OOP.md,/u/tschellenbach,6
0,2016-09-13 18:15:56 -0500,"['/t/ruby', '/t/satire']",One Base Class to Rule Them All (2011),https://www.destroyallsoftware.com/blog/2011/one-base-class-to-rule-them-all,/u/kb,0
3,2016-09-12 09:15:21 -0500,['/t/programming'],Operation Costs in CPU Clock Cycles,http://ithare.com/infographics-operation-costs-in-cpu-clock-cycles/,/u/mikejsavage,11
0,2016-09-12 11:37:43 -0500,['/t/programming'],Genode Operating System Framework,http://genode.org/,/u/mechazoidal,12
4,2016-09-12 00:57:39 -0500,"['/t/distributed', '/t/windows']",excel-messenger: A Terrible Experiment In VBA,http://tristancalderbank.com/2016/09/06/excel-messenger-a-terrible-experiment-in-vba/,/u/antifuchs,27
0,2016-09-12 13:34:38 -0500,"['/t/compsci', '/t/historical', '/t/math']",Why Writing Correct Software Is Hard,http://blog.paralleluniverse.co/2016/07/23/correctness-and-complexity/,/u/kel,8
0,2016-09-12 12:29:18 -0500,['/t/programming'],Input threads in the X server,http://who-t.blogspot.com/2016/09/input-threads-in-x-server.html,/u/calvin,9
6,2016-09-12 12:14:14 -0500,"['/t/cryptocurrencies', '/t/security']",How To Compromise Zcash And Take Over The World,https://blog.okturtles.com/2016/09/how-to-compromise-zcash-and-take-over-the-world/,/u/Don_Pellegrino,4
0,2016-09-12 08:54:57 -0500,['/t/programming'],Higher-rank and higher-kinded types,https://www.stephanboyer.com/post/115/higher-rank-and-higher-kinded-types,/u/asthasr,12
0,2016-09-12 07:28:20 -0500,"['/t/api', '/t/lisp', '/t/web']",Using clojure.spec to declaratively parse http query parameters,https://www.bevuta.com/en/blog/declaratively-parse-query-params-using-clojure-spec/,/u/the-kenny,6
0,2016-09-12 16:07:17 -0500,"['/t/hardware', '/t/science']",Terahertz time-gated spectral imaging for content extraction through layered structures,http://cameraculture.media.mit.edu/can-computers-read-through-closed-books/,/u/pushcx,4
0,2016-09-12 13:51:53 -0500,['/t/historical'],"Restoring YCombinator's Xerox Alto day 6: Fixed a chip, data read from disk",http://www.righto.com/2016/09/restoring-ycombinators-xerox-alto-day-6.html,/u/chadski,4
2,2016-09-12 07:57:29 -0500,['/t/security'],"Malware Infects 70% of Seagate Central NAS Drives, Earns $86,400",https://news.slashdot.org/story/16/09/11/0028238/malware-infects-70-of-seagate-central-nas-drives-earns-86400,/u/rbn,5
0,2016-09-12 13:17:51 -0500,['/t/devops'],Push a Docker DAB to a Kubernetes Cluster in Two Commands!,https://deis.com/blog/2016/push-docker-dab-kubernetes-cluster/,/u/nslater,4
0,2016-09-12 04:42:24 -0500,['/t/compsci'],On Generative Algorithms,http://inconvergent.net/generative/,/u/Dawny33,11
0,2016-09-12 14:25:51 -0500,['/t/databases'],Fun with SQL: Computing run rate and month over month growth,https://www.citusdata.com/blog/2016/09/12/fun-with-sql-computing-run-rate-and-growth-with-ctes-and-window-functions/,/u/craigkerstiens,1
3,2016-09-11 19:34:47 -0500,['/t/graphics'],The new v40 TrueType interpreter mode,https://www.freetype.org/freetype2/docs/subpixel-hinting.html,/u/calvin,18
0,2016-09-12 05:57:32 -0500,['/t/compsci'],WaveNet: A Generative Model for Raw Audio,https://deepmind.com/blog/wavenet-generative-model-raw-audio/,/u/adsouza,6
1,2016-09-11 23:45:52 -0500,"['/t/pdf', '/t/lua', '/t/reversing', '/t/security']",Escaping the Lua 5.2 Sandbox With Untrusted Bytecode,https://apocrypha.numin.it/talks/lua_bytecode_exploitation.pdf,/u/friendlysock,10
